URL,Version,Status,OIDs,Name,Title,Description,Uses,Used,Sources
https://interop.esante.gouv.fr/ig/document/core/ValueSet/fr-doc-vs-participation-type,0.1.0,draft,,FRValueSetParticipationType,FR ValueSet Participation Type,"Type de participation : destinataire",,"THO (V3)"
https://interop.esante.gouv.fr/ig/document/core/ValueSet/fr-doc-vs-role-prise-charge,0.1.0,draft,,FRValueSetRolePriseCharge,Fr ValueSet RolePriseCharge,"Pour les professions 41 (Assistant de service social) et 99 (Acteur caractérisé par son rôle).",,"ans.fr.terminologies"
https://interop.esante.gouv.fr/ig/document/core/ValueSet/fr-vs-actor-type-document,0.1.0,draft,,FRValueSetActorTypeDocument,ValueSet - FR ValueSet Actor Type Document,"Jeu de valeurs pour les types d'acteurs.",,"THO (V3)"
https://interop.esante.gouv.fr/ig/document/core/ValueSet/fr-vs-allergy-substance,0.1.0,draft,,FRValueSetAllergySubstanceDocument,ValueSet – FR ValueSet Allergy Substance Document,"Jeu de valeurs permettant de coder l’agent responsable d’une allergie : - Médicaments : CIP ou UCD - Substances : SMS - Aliments : CIM-11 Chapitre X Extensions – Allergènes ou substances non médicinales - Agents environnementaux ou physiques : idem CIM-11 Chapitre X Extensions - Allergènes pouvant induire une contre-indication vaccinale : jdv-allergie-vaccin-cisis",,"ans.fr.terminologies,hl7.terminology.r4,Other"
https://interop.esante.gouv.fr/ig/document/core/ValueSet/fr-vs-edqm-document,0.1.0,draft,,FRValueSetEDQMDocument,ValueSet - FR ValueSet EDQM Document,"ValueSet basé sur le CodeSystem EDQM fourni par SMT",,"ans.fr.terminologies"
https://interop.esante.gouv.fr/ig/document/core/ValueSet/fr-vs-evaluation-type,0.1.0,draft,,FRValueSetEvaluationTypeDocument,ValueSet – FR ValueSet Type d'évaluation,"Codes autorisés pour indiquer le type d'évaluation. Inclut LOINC, ICF, et permet d'autres systèmes si aucun code approprié n'est trouvé.",,"LOINC,hl7.terminology.r4"
https://interop.esante.gouv.fr/ig/document/core/ValueSet/fr-vs-medication-translation-document,0.1.0,draft,,FRValueSetMedicationTranslationDocument,ValueSet - FR ValueSet Medication Translation Document,"Systèmes autorisés pour les autres codifications.",,"ans.fr.terminologies,Other"
https://interop.esante.gouv.fr/ig/document/core/ValueSet/fr-vs-procedure-code,0.1.0,draft,,FRValueSetProcedureCodeDocument,ValueSet – FR ValueSet Codes d’actes,"Codes autorisés pour indiquer un acte. Inclut : - Terminologie CCAM - NCIT (code C25218 : 'Intervention') si l'acte n'est pas trouvé dans CCAM - CISIS jdv-absent-or-unknown-procedure-cisis pour actes chirurgicaux inconnus ou absents.  Si aucun code approprié n’est disponible, l’acte peut être décrit en texte libre.",,"ans.fr.terminologies,hl7.terminology.r4"
https://interop.esante.gouv.fr/ig/document/core/ValueSet/fr-vs-result-type-document,0.1.0,draft,,FRValueSetResultTypeDocument,ValueSet - FR ValueSet Result Type Document,"ValueSet contenant les codes LOINC autorisés pour les types de résultats",,"LOINC"
